<read_report version="2" xmlns:xsi="http://www.w3.org/2001/XMLSchema-instance" xsi:schemaLocation="http://www.rpath.com/permanent/rpath-configurator-2.0.xsd rpath-configurator-2.0.xsd">
    <name>apache_configuration</name>
    <errors>
        <error>
            <code>500</code>
            <details><![CDATA[Apache not started]]></details>
            <summary>General error: apache not running</summary>
        </error>
        <error>
            <code>1</code>
            <details><![CDATA[Traceback: A bunch of tb data]]></details>
            <summary>Error when stuff broke, fix it</summary>
        </error>
    </errors>
    <properties>
        <property>
            <name>port</name>
            <value>81</value>
        </property>
        <property>
            <name>debug_level</name>
            <value>true</value>
        </property>
    </properties>
</read_report>
